field_id,field_url,Code,Rue,Localité,Synthétique,Stabilisé,Situation,Acces voiture
A01,https://www.abssa.org/terrain/A01,A01 (ANDERLECHT                                                  ),Avenue d'Itterbeek,1070 Anderlecht,False,False,BON AIR,"Par le Ring Ouest, direction Paris, sortie Westland Shopping Center (n° 14) continuer tout droit, remonter vers le Ring et prendre à droite pour sortir vers Itterbeek. Prendre l'avenue d'Itterbeek au parc d'Anderlecht, passer le ring, reste 2 km. Le terrain se trouve à gauche, entre l'école Van Belle et Veeweyde."
A02,https://www.abssa.org/terrain/A02,A02 (ANDERLECHT                                                  ),Drève Olympique,1070 Anderlecht,False,False,STADE JESSE OWENS,"Par le ring Ouest, direction Paris, sortie 15 (Pede), prendre à droite puis 1ére à gauche rue de Neerpede. Au rond-point, suivre les flèches ""Déviation"" et faire le tour du lac (par la rue de Neerpede, la rue du Chaudron, la rue des poulets et la rue Scholle). On revient sur le 2éme rond-point (drève olympique) et prendre directement à droite. Le terrain se trouve en face de la piste de ski.
Par le ring direction Bruxelles, sortie Lennik-Erasme, passer le premier rondpoint et après 2ààm, prendre à droite la rue Scholle (indication : Amicale Golf Club). Longer le golf jusqu'au rondpoint (drève olympique) et prendre directement à droite. le terrain se trouve
en face de la piste de ski."
A03,https://www.abssa.org/terrain/A03,A03 (ANDERLECHT                                                  ),"Route de Lennik, 1015",1070 Anderlecht,False,False,COMPLEXE SPORTIF DE SAINT GILLES (BARKA),"Ring, sortie Hopital Erasme, après 300 m. en direction de Lennik, prendre à droite.
Venant de la chaussée de Mons, carrefour Av. Fr. Van Kalken, Bld. A. Briand, place Verdi, Bld. Théo Lambert, Bld. M. Carème, après l'hopital Erasme 400 m. en direction de Lennik."
A04,https://www.abssa.org/terrain/A04,A04 (ANDERLECHT                                                  ),"Chaussée de Mons, 1421",1070 Anderlecht,False,False,INSTITUT SAINT NICOLAS,"Par la chaussée de Mons, direction Halle, entrée au n° 1421 (à droite) en face de l'usine Coca Cola."
A05,https://www.abssa.org/terrain/A05,A05 (ANDERLECHT                                                  ),"Route de Lennik, 57",1070 Anderlecht,False,False,LA ROUE,"Par la chaussée de Mons, direction Halle, ensuite prendre la Route de Lennik.
L'entrée du complexe est située Rue Pierre Schlosser, 31."
A06,https://www.abssa.org/terrain/A06,A06 (ANDERLECHT                                                  ),"Rue du Transvaal, 39-41",1070 Bruxelles,True,False,STADE VERCAUTEREN,"En partant de la gare du Midi par l'avenue Fonsny en direction de Forest, prendre la première rue à droite (pont du chemin de fer) pour aller rejoindre la rue des Vétérinaires. Dans la rue des Vétérinaires, au rond-point, prendre la 3ème sortie (rue Emile Carpentier, puis la première à droite la rue du Transvaal."
A08,https://www.abssa.org/terrain/A08,A08 (ANDERLECHT                                                  ),Boulevard Théo Lambert,1070 Anderlecht,True,False,STADE VERDI (STADIUM),"Via la chaussée de Mons jusqu'à Veeweyde (carrefour Fr. Van Kalken). Prendre à droite le boulevard  A. Briand jusqu'à la Place Verdi, puis le Bld. Théo Lambert."
A09,https://www.abssa.org/terrain/A09,A09 (ANDERLECHT                                                  ),Rue du Chant d'Oiseau,1070 Anderlecht,False,False,COMPLEXE DU VOGELENZANG,"En venant de la Route de Lennik (Citroën) ou de la Chaussée de Mons (Ikea), prendre la direction du cimetière d'Anderlecht, emprunter le Boulevard Josse Leemans, au rond-point prendre la sortie pour la rue du Chant d'Oiseaux (Vogelenzang). L'entrée du complexe et des terrains se situe à +/- 500 m. sur la gauche."
A10,https://www.abssa.org/terrain/A10,A10 (AUDERGHEM                                                   ),"Chaussée de Wavre, 2057",1160 Auderghem,False,False,COMPLEXE DE L'ADEPS,L'accès au terrain se fait à partir du n° 2057 de la chaussée de Wavre (en face du stade communal d'Auderghem). L'accès au terrain se fait par l'arrière du bâtiment principal (où sont situés les vestiaires) il faut parcourir environ 300 mètres avant d'atteindre le terrain de football situé après la piste d'athlétisme et le terrain de hockey.
A11,https://www.abssa.org/terrain/A11,A11 (AUDERGHEM                                                   ),"Chaussée de Wavre, 1854",1160 Auderghem,False,False,COMPLEXE COMMUNAL,"En venant de Bruxelles par la chaussée de Wavre, rejoindre le du début de l'autoroute Bruxelles-Namur, utiliser la bande de droite pendant +/- 200 m. et descendre devant le bâtiment de l'ADEPS, puis passer par le tunnel à gauche (en dessous de l'autoroute). Le terrain se trouve à 200 m. Le stade est fléché."
A12,https://www.abssa.org/terrain/A12,A12 (ARQUENNES                                                   ),Rue Omer Lion,7181 Arquennes,False,False,STADE COMMUNAL A. PLENNEVAUX,"Autoroute E 19 (Bruxelles-Charleroi), sortie Arquennes. Direction Seneffe-La-Louvière. A la station d'essence Total, prendre à droite pendant +/- 700 mètres.
Au rond point, prendre à droite en direction du château de La Rocq, passez sous le pont, le terrain se trouve à 100 mètres (à proximité du cimetière)."
B01,https://www.abssa.org/terrain/B01,B01 (BIERGES                                                     ),Rue des Combattants,1301 Bierges,False,False,COMPLEXE SPORTIF J. COLETTE,"Autoroute Bruxelles-Namur, sortie Bierges, prendre à droite, le terrain se trouve à +/- 500 m. du côté droit."
B02,https://www.abssa.org/terrain/B02,B02 (BIERGHES-REBECQ                                             ),"Rue du Sartiau, 3B",1430 Bierghes-Rebecq,False,False,,"Autoroute Bruxelles-Charleroi (E19), prendre la sortie Halle-Tournai-Lille (n° 21) pour rejoindre l'autoroute Tournai-Lille, ancienne route A8 (E429). Prendre la sortie Rebecq-Quenast (n° 24). En bas de la sortie, prendre à droite, direction Bierghes. Rouler tout droit jusqu'au premier feu rouge. Tourner à droite en direction de Halle, ensuite la deuxième rue à droite (rue du Sartiau), ensuite à gauche. Le terrain se trouve à 300 m."
B03,https://www.abssa.org/terrain/B03,B03 (BRAINE-L'ALLEUD                                             ),Boulevard de l'Europe,1420 Braine - l'Alleud,False,False,STADE GASTON REIFF,"En venant de Bruxelles, emprunter la chaussée de Bruxelles ou de Waterloo jusqu'au magasin ""Carrefour"". Au dit carrefour (Mont-St.-Jean) prendre la direction Nivelles. Sur cette chaussée, au deuxième feu de signalisation, prendre à droite, le terrain se trouve à 500 m. et est fléché."
B04,https://www.abssa.org/terrain/B04,B04 (BRAINE-LE-CHATEAU                                           ),Rue de Tubize,1440 Braine-Le-Chateau,False,False,E.S. BRAINOISE,"Autoroute Bruxelles-Mons, sortie Wauthier-Braine, direction Tubize. Le terrain se trouve sur la route de Tubize à droite après la Grande Place de Braine-Le-Chateau."
B05,https://www.abssa.org/terrain/B05,B05 (BRUXELLES-HAEREN                                            ),Rue de la Paroisse,1130 Haeren,True,False,,"Chaussée de Haecht, vers Diegem. Prendre la rue Harenheyde à gauche, juste au feu de signalisation, après la station ""JET"", situé à gauche. Entrée du stade par la rue Harenheyde, 100 m. au-delà du pont du chemin de fer."
B06,https://www.abssa.org/terrain/B06,B06 (BRUXELLES-HAEREN                                            ),Rue du Biplan,1130 Haeren,False,False,COMPLEXE SPORTIF DE LA S.T.I.B.,"Ring Ouest, sortie Brussel-Evere-Zaventem Luchthaven (il n'y a pas de numéro de sortie car l'autoroute continue presque jusque devant l'OTAN) , suivre direction Evere, prendre à droite au 2ème feu de signalisation (Avenue Jules Bordet). Passer le feu de signalisation du croisement avec la chaussée de Haecht. Prendre la 2ème rue à main droite (impossible de continuer tout droit) rue de Verdun et suivre les indications ""Centre Sportif de la STIB - Sportcomplex STIB"" (1ère rue à main droite est la rue du Biplan).
De la Place Meiser-Bld. Léopold III. Au 5ème feu de signalisation (bâtiment I.N.G.) prendre à gauche l' Avenue Bordet et ensuite la 1ère rue à droite après le carrefour de la chaussée d'Haecht."
B07,https://www.abssa.org/terrain/B07,B07 (BRUXELLES                                                   ),Avenue de Bouchout (Atomium),1020 Bruxelles,False,False,HEYSEL - ANNEXE 3,"Ring de Bruxelles, Sortie Wemmel, prendre l'Avenue Houba de Strooper, puis la rue à gauche, avant le bâtiment de l'URBSFA, direction Atomium."
B08,https://www.abssa.org/terrain/B08,B08 (BRUX.-NEDER OVER HEEMBEEK                                   ),"Petit Chemin Vert, 99",1120 Neder-Over-Heembeek,False,False,PETIT CHEMIN VERT,"Pont de Laeken, Chaussée de Vilvorde, vers Neder-Over-Heembeek, prendre l' Avenue des Croix de Guerre jusqu'au rond-point, tout droit Chemin Vert, puis première à gauche, Petit Chemin Vert, terrain à 300 m."
B09,https://www.abssa.org/terrain/B09,B09 (BRUX.-NEDER OVER HEEMBEEK                                   ),"Avenue des Croix de Guerre, 3",1120 Neder-Over-Heembeek,False,False,"COMPLEXE DU ""BLACKSTAR""","A partir du Pont Van Praet, prendre la Chaussée de Vilvorde et ensuite la première rue à gauche, rue Général Biebuyck, puis première à gauche, Avenue des Croix de Guerre."
B10,https://www.abssa.org/terrain/B10,B10 (BRAINE L'ALLEUD                                             ),"Chaussé de Mont Saint Jean, 83",1420 Braine l'Alleud,False,False,COLLEGE CARDINAL MERCIER,"En venant de Bruxelles, emprunter la Chaussée de Bruxelles jusqu'au magasin ""Carrefour de Mont Saint Jean (Mac Donald). Au rond point, prendre la 3ème sortie vers Braine l'Alleud, puis à droite la Chaussée de Mont Saint Jean."
B11,https://www.abssa.org/terrain/B11,B11 (BRAINE-LE-COMTE                                             ),"Rue du Poseur, 39",7090 Braine-Le-Comte,False,False,,"En venant de Bruxelles : Autoroute Tournai - Lille (A8), prendre la sortie n° 24, direction Rebecq, puis la N 6 Bruxelles-Mons en direction de Mons. Entrer dans l'agglomération de Braine-Le-Comte et prendre la 1ère rue à droite, le terrain se situe au bout de la rue.
En venant de Nivelles : Prendre la N533, Nivelles/Braine-Le-Comte. Entrer dans l'agglomération de Braine-Le-Comte et suivre la direction de Bruxelles (N 6 Mons-Bruxelles), prendre la 1ère rue à gauche, le terrain se situe au bout de la rue."
B12,https://www.abssa.org/terrain/B12,B12 (BOORTMEERBEEK                                               ),"Sportveldweg, 6",3190 Boortmeerbeek,False,False,,"En venant de Bruxelles, prendre l'autoroute E19 en direction d'Anvers. Prendre la sortie Zemst. Au bout de la sortie en haut prendre à droite jusqu'au feu de signalisation. Traverser le carrefour et un peu plus loin à droite suivre le panneau ""Schiplaken"". Suivre cette route jusqu'au carrefour en forme de ""T"". Tourner à droite jusqu'au feu de signalisation, puis prendre à gauche et suivre la panneau ""Sporthall"" (il ne faut pas suivre l'indication du terrain du KRC Boortmeerbeek)."
B13,https://www.abssa.org/terrain/B13,B13 (BEERSEL                                                     ),"Schoolstraat, 46",1650 Beersel,False,False,,"A partir du Ring de Bruxelles prendre la E 19 direction Paris.
Quitter le Ring par la sortie 19, prendre à gauche sur Beerselsestraat, après 900 m. prendre à gauche sur Lotsestraat, après 400 m. continuer sur Puttestraat, puis prendre à droite sur Hoogstraat, puis prendre à gauche sur Kerkveldstraat. Après prendre à droite sur Schoolstraat, le terrain se trouve sur la droite."
B14,https://www.abssa.org/terrain/B14,B14 (BEAUVECHAIN                                                 ),"Rue de la Grande Lecke, 3",1320 Beauvechain,True,False,,"A partir de Bruxelles, prendre la E 411 en direction de Namur. Prendre la sortie N° 8 puis à droite la bretelle pour la N 25 vers Chaumont-Gistoux / Grez Doiceau / Louvain. Après +/- 6,5 km, au rond-point, prendre la sortie 1 vers la N 420 Chée. de la Libération, puis à gauche dans la rue de la Grande lecke."
C01,https://www.abssa.org/terrain/C01,C01 (CHASTRE                                                     ),Rue des Quinze Bonniers,1450 Chastre,False,False,COMPLEXE SPORTIF DES XV BONNIERS,"En venant de Bruxelles, prendre l'autoroute E411 en direction de Namur. Prendre la sortie  ""Corroy-Le-Grand"" (n° 9). Prendre à droite direction Nivelles. Au rond-point prendre à gauche, la N4 en direction de Walhain. Au 3ème feu de signalisation prendre à droite, direction Chastre. Au rond-point, tout droit, direction Chastre. Juste après le pont du chemin de fer prendre à droite en direction de Villeroux. Traverser tout le village de Chastre. Le complexe se trouve à la sortie du village, sur la droite et est fléché."
C02,https://www.abssa.org/terrain/C02,C02 (COURT ST. ETIENNE                                           ),Avenue des Combattants,1490 Court St. Etienne,True,False,,"Ring ouest: Direction Waterloo, prendre la sortie ""butte du lion"" , prendre à droite, puis au feu rouge prendre à droite, rouler jusque Genappe et prendre la RN 25 en direction de Wavre, prendre la deuxième sortie (Court St. Etienne) et prendre à gauche, le terrain se trouve à 1 km. a main droite.
Par la E411: Prendre la E411 direction Namur, ensuite sortir a Wavre, prendre ensuite la sortie Villers-La-Ville, ensuite à droite puis directement à gauche a l'arbre et descendre jusque dans le fond, prendre a droite et le terrain se trouve à 500 m. a main gauche."
C03,https://www.abssa.org/terrain/C03,C03 (CHAUMONT-GISTOUX                                            ),"Avenue du Ronvau, 8",1325 Chaumont-Gistoux,False,False,COMPLEXE SPORTIF DU RONVAU,"Par la E411, Sortie ! ""Louvranges"", direction Louvain - Grez Doiceau - Chaumont-Gistoux,
continuer sur la N25, prendre la sortie en direction de Wavre - Perwez - Chaumont-Gistoux,
prendre à droite la 243 (+/- 4 km.), traverser Chaumont-Gistoux, prendre à gauche la rue de Wavre (devant le café de la Poste), continuer sur la rue Colleau, ensuite la rue du Pont des Brebis. Arrivée avenue du Ronvou."
D01,https://www.abssa.org/terrain/D01,D01 (DROGENBOS                                                   ),Rue au Bois,1620 Drogenbos,False,False,STADE COMMUNAL DE DROGENBOS,"Prendre l'Autoroute ou le ring Bruxelles-Mons-Paris, sortie Drogenbos. Prendre direction Drogenbos-Centre, passer devant la Maison Communale et le terminus du tram, ensuite à la 3ème rue tourner à main droite (Le terrain se trouve au bout de la rue au Bois)."
E02,https://www.abssa.org/terrain/E02,E02 (ENGHIEN                                                     ),Rue Saint Quentin,7850 Enghien,False,False,R. ENGHIEN SPORT (PARC),"Prendre la E429 (Lille-Tournai-Ath) à hauteur de Halle. Prendre la sortie Petit-Enghien-Hoves (25), prendre à droite, direction  Petit-Enghien. Au bout de la route prendre à gauche, direction Enghien. Arrivé à Enghien, prendre la 2ème rue à gauche, suivre le panneau ""Auberge du Vieux Cèdre""."
E04,https://www.abssa.org/terrain/E04,E04 (ETTERBEEK                                                   ),Rue Baron Dhanis,1040 Etterbeek,True,False,,"De la Place Meiser, remonter tous les boulevards. Au carrefour de la Chaussée de Wavre, prendre celle-ci à droite, ensuite la 2ème rue à droite (Rue Général Fivé), puis la 3ème à droite (rue Baron Dhanis)."
E07,https://www.abssa.org/terrain/E07,E07 (EVERE                                                       ),"Avenue des Anciens Combattants, 300",1140 Evere,False,False,COMPLEXE SPORTIF EVERE,"Boulevard Lambermont, prendre le boulevard Léopold III, direction aéroport de Bruxelles-National, au 3ème feu de signalisation prendre à droite. le terrain se trouve à 50 m."
E08,https://www.abssa.org/terrain/E08,E08 (EVERE                                                       ),Rue de Picardie,1140 Evere,False,False,PARC ST. VINCENT (BON PASTEUR),Le terrain se trouve derrière l'église St. Vincent
E10,https://www.abssa.org/terrain/E10,E10 (EVERE                                                       ),Avenue des Communautés,1140 Evere,False,False,STADE COMMUNAL G. PETRE,"Prendre la chaussée de Louvain, Place Meiser, Place de Paduwa, prendre ensuite la 2ème rue à droite, l' Avenue des Communautés, l'entrée au terrain est situé à 100 m."
F01,https://www.abssa.org/terrain/F01,F01 (FOREST                                                      ),Av. de la 2ème Armée Britannique,1190 Forest,False,False,COMPLEXE SPORTIF DU BEMPT,"Au départ de la Place St. Denis à Forest prendre la chaussée de Neerstalle jusqu'à la rue de la Soierie (4ème rue à droite) et dans la rue de la Soierie rouler env. 100 m. puis 1ère à gauche (Bld. de la 2ème Armée Britannique) pendant env. 500 m. L'entrée du Complexe se trouve à hauteur de City Cart, à gauche de la route."
G01,https://www.abssa.org/terrain/G01,G01 (GENVAL                                                      ),"Rue du Tilleul, 50",1332 Genval (Rixensart),False,False,COMPLEXE DU TILLEUL,"Prendre l'autoroute de Namur (E411), sortie n° 4 - (Genval-Rosières). En bas de la sortie prendre la deuxième rue à droite (rue de La Hulpe) direction ""Genval - Maubroux"". Au premier rond point continuez à suivre la direction ""Genval - Maubroux"" (continuation de la rue de La Hulpe). Au rond point suivant, suivre toujours la direction ""Genval-Maubroux"". Au troisième rond point (Café du Lac sur la gauche) suivre toujours la direction ""Genval-Maubroux"" (3ème sortie - rue de Genval). Continuez tout droit jusqu'au feu de signalisation (Eglise de Genval) et tourner à droite (Avenue Albert 1èr). Après +/- 800 mètres, à l'ancienne station service, prendre à gauche et suivre la route (rue Joseph Desmet) sur +/- 700 mètres, puis tourner à droite, rue du Tilleul (panneau : Les Charmettes). Le terrain se trouve à environ 200 mètres sur la droite."
G02,https://www.abssa.org/terrain/G02,G02 (GENAPPE                                                     ),"Rue de Ways, 117",1470 Genappe,False,False,,"En venant de Waterloo, prendre la sortie Genappe (n° 25) prendre la N5 (Bruxelles-Charleroi) en direction de Charleroi pendant +/- 10 km. Après la station Total, au feu de signalisation, prendre à droite vers le centre de Genappe. Au 1èr feu de signalisation prendre à gauche la N237 direction Ottignies-Wavre. Après env. 300 m. et au bas de la descente prendre le petit chemin à droite.
Via Nivelles, prendre la sortie d'autoroute Nivelles-Sud (n° 19) et suivre la direction Wavre, sur la RN25 (sortie Genappe), prendre vers Genappe. Après 1500 m. prendre à gauche la N237 direction Ottignies-Wavre. Après env. 300 m. et en bas de la descente prendre le petit chemin à droite."
G03,https://www.abssa.org/terrain/G03,G03 (GANSHOREN                                                   ),Rue A. Roobaert,1083 Ganshoren,True,False,,"Par la ville. A partir de la Basilique de Koekelberg, prendre l'Avenue Charles Quint, prendre 3ème rue à droite, Avenue de Villegas. Arrivé au rond point prendre la 3ème sortie et  continuer sur l'avenue Marie de Hongrie. Prendre ensuite la première à droite, l'avenue des Neuf Provinces. Au 2ème rond point, prendre la première sortie, rue Vanderveken. Un parking est accessible dans la première rue à gauche. (Indication Hall des Sports).
Par le ring. En sortant du ring à Koekelberg, prendre l'avenue Charles Quint. Au 3ème feu, prendre à gauche sur la place Marguerite d'Autriche. Prendre la 1ère rue à droite et rester sur l'avenue Marie de Hongrie. Ensuite suivre comme ci-dessus."
G04,https://www.abssa.org/terrain/G04,G04 (GREZ-DOICEAU                                                ),Rue du Stampia,1390 Grez-Doiceau,False,False,,Autoroute Bruxelles-Namur (E411) prendre la sortie Louvain/Grez-Doiceau (n° 8). Prendre la RN25 en direction de Louvain/Grez-Doiceau. Passer tout droit les deux premiers ronds-points à l'issue de la RN 25. Au troisième rond-point prendre à droite. Le terrain se trouve 150 m. plus loin à gauche de la rue du Stampia.
H01,https://www.abssa.org/terrain/H01,H01 (HEVILLERS                                                   ),"Rue des Tilleuls, 60",1435 Hévillers,False,False,,"Autoroute Bruxelles/Namur (E411), sortie n° 9, prendre à droite jusqu'au rond-point. Puis prendre à gauche, direction Gembloux/Chastre/Corbais, jusqu'au 1èr feu de signalisation. Prendre ensuite à droite jusqu'au chemin de fer, tourner à gauche, emprunter le tunnel, puis continuer tout droit jusqu'au terrain de O.N.E., +/- 500 m. ce qui est en face du n° 87"
H03,https://www.abssa.org/terrain/H03,H03 (HOFSTADE                                                    ),Ossebeemden,1981 Hofstade,False,False,VERBROEDERING HOFSTADE,"A partir de l'E19 Bruxelles-Antwerpen (Sortie 11 Zemst-Weerde-Hofstade) prendre à droite la Robert Schumanlaan. Au premier feu de signalisation, prendre à gauche la Tervuursesteenweg (N227) jusqu'à l'église de Hofstade (+/- 1,7 km.) Continuez encore 200 m. puis tourner à gauche au café Hoekske. Vous roulez sur la Zemstsesteenweg. Après 200 m. prendre la deuxième à droite (au café de Sportvriend) la Ossebeemden, vous verrez le parking un peu plus loin."
H04,https://www.abssa.org/terrain/H04,H04 (HOUTAIN-LE-VAL                                              ),"Rue de Ninove, 1",1476 Houtain-Le-Val,False,False,,"Venant de Bruxelles prendre le Ring Ouest, sortie Genappe (n°25), prendre à droite sur la N 5 (Bruxelles-Charleroi) direction Charleroi pendant +/- 10 min. Prendre à gauche au carrefour entre la N 5 et la N 93 direction Nivelles. Dans le village, prendre à gauche au carrefour en direction de la rue des Ecoles. une centaine de mètres plus loin, prendre immédiatement à droite en direction de la rue du Béguinage et ensuite prendre imméeiatement à gauche en direction de la rue du Pavillon. Suivre cette rue jusqu'au ""T"" formé par la rue du Pavillon et la rue de Ninove. Au ""T"" prendre à gauche. Le terrain de football se situe à une centaine de mètres sur le côté droit."
I01,https://www.abssa.org/terrain/I01,I01 (ITTRE                                                       ),Rue J. Jolly (Impasse),1460 Ittre,False,False,J.S. ITTROISE,"Autoroute Bruxelles-Paris prendre la sortie Ittre, direction Centre. En partant de la Grande Place (Eglise) prendre la rue Basse. Après 100 m. tourner à gauche (rue Neuve) après 100 m. tourner à gauche, (rue de l'Ecole) pour arriver à la Rue J. Jolly."
I02,https://www.abssa.org/terrain/I02,I02 (IXELLES                                                     ),"Rue Volta, 18",1050 Ixelles,True,False,STADE A. DEMUYTER,"Avenue de la Couronne jusqu'au cimetière d'Ixelles, suivre les plaques ""Stade A. Demuyter""."
I03,https://www.abssa.org/terrain/I03,I03 (INCOURT                                                     ),Rue de la Bruyère,1315 Incourt,False,False,INCOURT,"En venant de Bruxelles, prendre l’E411 en direction de Namur et prendre la sortie 11 Perwez-Gembloux, prendre à droite vers Perwez sur la N29 jusqu’au rond-point de Glimes qui croise la N91 (7km depuis l’E411). Sortir à la 3ème sortie sur la N91 en
direction de Hamme-Mille. Prendre ensuite la 3ème rue à gauche et le terrain se trouve directement sur la droite."
J01,https://www.abssa.org/terrain/J01,J01 (JETTE                                                       ),Avenue J.J. Crocq,1090 Jette,False,False,COMPLEXE SPORTIF DU HEYMBOSCH,"Direction cimetière de Jette, ensuite prendre la rue du ""Sacré-Coeur"" jusqu'au bout, puis tout droit, avenue J.J. Crocq. Le terrain se trouve à gauche."
J02,https://www.abssa.org/terrain/J02,J02 (RSD JETTE (COMPLEXE EXPO)                                   ),"Avenue de l'Exposition, 257",1090 Jette,False,False,,"Ring de Bruxelles, sortie 9 Jette.
En venant de Zaventem, prendre à gauche à la sortie, en venant de Charleroi prendre à droite. Au feu rouge continuer sur +/- 1 km jusqu'au rond point. Le terrain se trouve en face de la pompe à essence Q8."
K02,https://www.abssa.org/terrain/K02,K02 (KRAAINEM                                                    ),Bosstraat,1950 Kraainem,False,False,,"Au départ de la Place Meiser, l'autoroute Bruxelles-Liège (E40), prendre la sortie Kraainem (n° 2). Sous le viaduc prendre à droite, l'avenue des Anciens Combattants. Juste après le carrefour avec des feux de signalisation prendre à droite vers la Place de la Chapelle, puis prendre la 4ème rue à main droite (rue au Bois). Le terrain se trouve à 300 m. sur la droite."
K03,https://www.abssa.org/terrain/K03,K03 (KONINGSLO                                                   ),"Streekbaan, 1",1800 Koningslo,False,False,,"Par le Ring, Sortie n° 6 (Koningsloo), prendre l'avenue de Tyras (vers l'Hopital militaire). Prendre directement à droite l'Indringersweg. Après 1 km, la Streekbaan est à droite. Le terrain se trouve au début de la rue, à gauche (FC Koningslo)"
L01,https://www.abssa.org/terrain/L01,L01 (LOUPOIGNE                                                   ),"Route du sucre, 1",1471 Loupoigne,False,False,Stade J.C. FLAMEND,"Venant de Bruxelles prendre le Ring Ouest, sortie Genappe (n° 25), prendre à droite sur la N5 (Bruxelles-Charleroi) direction Charleroi pendant +/- 10 min., sortie Loupoigne, traverser le carrefour, tout droit direction route du sucre."
